title,subreddit
Anybody willing to point me in the right direction?,NLP
"In order to understand a question, your brain has to answer it.",NLP
NLP Seminar with NLP Practitioner,NLP
I’m developing a cognitive behavior change method and need help.,NLP
NLP Training,NLP
Which all emotional states to anchor?,NLP
Instant Confidence: How to Use an NLP Anchor - Alpha Reboot,NLP
Photoreading Whole Mind System,NLP
How to free myself from bad memories using NLP?,NLP
Came across this guide to NLP - a great read for beginners or the curious.,NLP
Train The Trainer Delhi,NLP
NLP Master Practitioner,NLP
"Can NLP change your mental associations? If so, how?",NLP
"Modeling, lost on the wind?",NLP
NLP Seminar,NLP
What can i do with a master nlp practitioner certification (with no hypnotherapy/life coaching certification)?,NLP
Changework partner,NLP
"NLP Professional Courses, Training and Therapy center",NLP
Content (books/websites/etc.) to get over fears?,NLP
NLP Professional Practitioner Training And Courses For Nlp Therapy : Satya prakash : Free Download &amp; Streaming : Internet Archive,NLP
Need help with a girl,NLP
NLP Therapy and training in Goa,NLP
Open NLP Name Finder Model Training Sagar Gole's Blog,NLP
NLP Programming,NLP
NLP Therapy,NLP
Learning from others,NLP
"Made device for reading human thoughts, but it is impossible to publish the discovery. Russia.",NLP
NLP Neuro Linguistic Programming For NLP Training & Imagination,NLP
Could NLP Bring Out And Accentuate These Personality Traits?,NLP
nlp distance learning,NLP
NLP Practitioner Diploma,NLP
Practitioner in Integrative Person-Centred NLP and Hypnotherapy,NLP
What is NLP Therapy?,NLP
Newcomer Requesting Book Recommendation.,NLP
Here is an interesting NLP Discord channel. Has a variety of free content. New people are welcome. NLP Channel.,NLP
"Is anyone familiar with Allen Carr’s? Also, how does it work from a NLP standpoint?",NLP
How can i use nlp to combat procrastination/internet addiction,NLP
Using a combination of NLP & EFT to get rid of Unpleasant Emotions,NLP
New NLP and Hypnosis Channel,NLP
nlp online training,NLP
NLP High-Performance-State Games?,NLP
How to 'learn' to enjoy things?,NLP
NLP therapy,NLP
learning something new is extremely difficult for me,NLP
NLP and hypnotherapy,NLP
Blockade to intimacy,NLP
Recommendation on where to start?,NLP
Notice anything tricky about Michelle Obama’s speech at the DNC?,NLP
Stanford study identifies brain areas altered during hypnotic trances,NLP
"How to use the ""propulsion"" system?",NLP
Maximising Your Personal Potential with NLP and hypnotherapy training,NLP
NFNLP MEMBERS,NLP
Use Stories to Change Minds by Owen Fitzpatrick,NLP
Need some advice on vocabulary quiz distractor generation,NLP
Reprogram your brain,NLP
Any good classes,NLP
Keep checking my spreadsheet,NLP
Firms Working in NLP That Will Hire Entry Level Positions?,NLP
Change How You Feel Now ! - With Anthony Robbins [Must Watch],NLP
can some combination of NLP and game theory skills help in confirming existence of hidden agendas?,NLP
A modern answer to the question: what is NLP?,NLP
nlp training of USA,NLP
So who's here?,NLP
any advice for dealing with amygdala highjacking,NLP
hypnosis and nlp Training,NLP
are there any good NLP technique to recall with clarity an event while discarding any delusion about what happened,NLP
How to make powerful suggestions with NLP,NLP
Future wife,NLP
NLP and hypnotherapy,NLP
What is Modelling in NLP -NLP Training in Bangalore - Living With NLP - Naresh K Singh,NLP
Guilt for not wanting to have children,NLP
Guilty for not wanting to have children,NLP
NLP Resources,NLP
Cómo anclar un sentimiento positivo para usarlo más tarde,NLP
NLP and hypnotherapy,NLP
What NLP tricks should I watch out for?,NLP
NLP techniques from the real-life Wolf of Wall Street,NLP
Any advice or techniques to help get over a crush/infatuation/love for a co-worker I see daily?,NLP
Use nlp to overcome the stress of losing at competitive games,NLP
Outstanding free resource from an Audible audiobook [NLP: The New Technology of Achievement],NLP
How to Start?,NLP
The Science of Hypnosis (NLP = secret hypnosis),NLP
Can someone find or compile a collection of sources that help prove NLPs many nice uses?,NLP
Train The Trainer You have vivid memories of what you have learned with life experiences. This is exactly what you will learn to re-create during your training session when you undergo this immersive ‘Train The Trainer’ programme.,NLP
TTT Gurgaon,NLP
Nietzsche explains Neuro-Linguistic Programming,NLP
Train The Trainer Delhi,NLP
Awesome Movies to Practice and Learn NLP,NLP
Scripting My Brain,NLP
Corporate training using NLP is my cup of tea - Ramasubramanian,NLP
How to be Happy and the Moral Values to Success?,NLP
NLP Trainings in Delhi,NLP
If you think doubt is a indication of a limiting belief you set people up for the greatest possible disappointment,NLP
"I had the most INSANE motivation to achieve goals I've been procrastinating on, and now it's all but gone. Please help.",NLP
NLP Courses,NLP
Remove Negative People From Your Life,NLP
Remove Negative People From Your Life,NLP
Remove Negative People From Your Life,NLP
"How to make a thought automatic, self-sustaining and even intrusive?",NLP
Do you want to eliminate negative thoughts? Reinforce positive thoughts instead,NLP
NLP Training in Delhi,NLP
Is it possible to use NLP completely covertly and through text ? I am very curious about this application and would like to hear your insights and experiences .,NLP
How to Use Conversational Programming and Get What You Want Everytime,NLP
Sleep Fast With NLP Training in Delhi,NLP
Here is Why One Should Consider a NLP Training,NLP
NLP Training in Delhi : Success Maximum,NLP
The power of influence by Tony Robbins - Lots of NLP concepts and gold nuggets,NLP
Unlimited motivation using motivation direction,NLP
NLP Training in Delhi – NLPintensive,NLP
"White, black, lush big Ass for s...x. Here MwO8PrTf",NLP
NLP Coach Training in Delhi,NLP
Coaching with NLP | NLP courses | NLP training,NLP
NLP New Code Vs NLP Classic code,NLP
Tips To Study NLP Training Successful Way,NLP
Getting Motivated With NLP [4 exercises],NLP
Everyone Does his Best NLP Practitioner Certification,NLP
Tips To Study NLP The Successful Way,NLP
I've met a wonderful girl on here Dh6AxV,NLP
I found a match on this site who has become very special to me. HeIgffy08,NLP
Top Practical Uses For NLP,NLP
Everyone Does his Best NLP Training,NLP
"NLP Slack channel - Experfy's Data Discourse for Data Science, IoT, and Big Data experts. Click here for an invite and join in the conversation!",NLP
Resources on face-to-face sales?,NLP
NLP Training in Delhi : BusinessUniv,NLP
NLP Intensive Spring 2016 New Delhi,NLP
Businessuniv : NLP Training in Delhi,NLP
Why does nlp make me feel weird?,NLP
Building Confidence With NLP,NLP
Confidence With NLP Training,NLP
Learning difficulties resources,NLP
Goal Setting With NLP Certification in Delhi,NLP
NLP and meditation: complementary?,NLP
Building Confidence With NLP Training in Delhi,NLP
Confidence With NLP Training in Delhi,NLP
NLP for Minorities?,NLP
Mazda ads with Aaron Paul using NLP?,NLP
6 NLP Techniques You Can Use Right Now,NLP
Blushing on sight - can NLP help?,NLP
NLP India NLP Training in Hindi,NLP
NLP Training/Courses in India,NLP
NLP Training in Delhi,NLP
Richard Bandler in Delhi,NLP
NLP Certification in Delhi,NLP
How to Effortlessly Curve Weed Cravings With NLP[+video],NLP
NLP Training in India,NLP
NLP Training in India,NLP
Richard Bandler in Delhi,NLP
"Help me out here, Want to be a believer in NLP, but",NLP
NLP Certification in Delhi,NLP
NLP Master Practitioners Training,NLP
Register online for NLP Canada courses,NLP
10 Questions with David Snyder,NLP
"Communication, Relationships, & Feelings Question",NLP
NLP Training in Delhi : BusinessUniv,NLP
NLP techniques for rumination / brooding?,NLP
"Looking for an NLP coach in Solano, Napa, Yolo or Sacramento County North California",NLP
Best NLP Trainer in Delhi,NLP
Learning NLP - Newbie question on audio education resources,NLP
NLP- 7 Leadership Tips To Become A Great Leader Using NLP,NLP
NLP Training in Delhi,NLP
NLP Training in New Delhi,NLP
How can one use NLP to break free from addiction?,NLP
Time Travel is Possible… Sort of,NLP
Creating an affirmation for a block of mine,NLP
NLP Training in Delhi,NLP
NLP is an amazing tool to use in Various aspects,NLP
Paper on pseudo-profound bullshit - a lot of interesting NLP concepts behind this...,NLP
Best NLP Trainer in Delhi,NLP
NLP Training in Delhi,NLP
NLP Training in Delhi,NLP
Training processes for self development using NLP?,NLP
NLP Trainers in Delhi,NLP
NLP Training in New Delhi,NLP
Free course - Unconscious Influence & Persuasion - NLP,NLP
Free course - Unconscious Influence & Persuasion - NLP,NLP
Best NLP Trainer,NLP
NLP Training in Delhi,NLP
NLP Training in New Delhi,NLP
Best NLP Trainer,NLP
NLP Training in Delhi,NLP
NLP Training in New Delhi,NLP
NLP Training in Delhi,NLP
NLP Certifications in Delhi,NLP
NLP Training in Delhi,NLP
Remove Fear Of Talking To The Opposite Sex Using NLP,NLP
"Among my most popular courses, here are 2 courses of $29 each for FREE.",NLP
7 Resim 7 Söz,NLP
Sözün Özü,NLP
"Looking for communication advice: How to phrase it, when something is not true?",NLP
How To Choose a NLP Training in Delhi,NLP
NLP is an Amazing tool,NLP
2 powerful courses using Mind Power Techniques,NLP
How to assess the language register of speech?,NLP
Special Offer get these $49 courses each for FREE only for Today,NLP
Festive season Offer get these $49 courses each for FREE only for Today.,NLP
What are some simple techniques I can use to help someone else be better?,NLP
Short Story by Bandler and Grinder?,NLP
Free Course: NLP- How To Use A Person's Name For Instant Rapport,NLP
Looking for adventures of anybody,NLP
Yes its FREE .. Use the link below and take the course for FREE.,NLP
On huge demand I am offering 100% off on my most popular course.,NLP
On huge demand I am offering 100% off on my most popular course.,NLP
3 powerful courses using NLP & Persuasion & Self Hypnosis Techniques.,NLP
to watch Once Upon a Time Season 5 Episode 3 online free,NLP
Beginer resources for NLP,NLP
Student searching for advice...,NLP
Do we need a name change?,NLP
Japanese NLP,NLP
Where to start?,NLP
"Hypnosis, NLP and EFT. Three powerful therapeutic techniques",NLP
Emotional Intelligence Training,NLP
Everything you need to know to get started with NLP,NLP
"How do I extract relevant, meaningful information from a particular sentence?",NLP
NLP Training in Delhi,NLP
"Looking for strong, bright and creative NLP-minds",NLP
NLP Training in Delhi,NLP
What are some resources to study NLP?,NLP
NLP,NLP
NLP a pseudoscience can it back by science?,NLP
Good NLP Trainer,NLP
"Predictive Analytics, NLP Flag Psychosis with 100% Accuracy",NLP
Does NLP promote victim-blaming?,NLP
Good NLP Trainer,NLP
Having trouble visualizing,NLP
"Predictive Analytics, NLP Flag Psychosis with 100% AccuracyPredictive Analytics, NLP Flag Psychosis with 100% Accuracy",NLP
How to Choose a Good NLP Trainer,NLP
The Effective Communicator,NLP
Help installing and compiling Dada engine,NLP
Feedback from rapport training.,NLP
How do you get information out of a person without them realizing they're giving it to you? [strategy game],NLP
Looking For The Best NLP Trainers?,NLP
Is John Grinder out of the picture?,NLP
Selecting A Good NLP Training,NLP
New to LP. Need Help!,NLP
Best book to learn modeling process?,NLP
Nice talk by Richard Socher on applications of deeplearning for NLP (Fully Tagged and Searchable),NLP
Nice talk by Richard Socher on applications of deeplearning for NLP,NLP
NLP Practitioner Training,NLP
NLP- Get Rid Of Self Sabotage And Become Successful In Life,NLP
NLP was partially based on Gregory Bateson's work for the OSS (became CIA) and MK-ULTRA. Gregory Bateson continued to actively influenced NLP.,NLP
Found this short and concise introductory e-book by an Australian NLP company - It reads easy but not sure if it is a bit too advanced,NLP
Some questions about resource anchoring in NLP?,NLP
Any experts in NLP out there? I want to know How accurate is the article in this link,NLP
'The Who is Who of NLP' - The 10 People Who Started It All and How Each Contributed to the Development of this Field (Does not include Tony Robbins),NLP
Básico de Vendas com PNL – Parte 1 | Marketing de Conteúdo e Vendas,NLP
NLP courses by Pradeep Aggarwal for FREE,NLP
"having trouble with ""the meaning of a communication is in the response you get.""",NLP
Teaching yourself a new language using NLP principles?,NLP
"Got frogs into princeses, it's all coming back to me now. I'm really getting into it",NLP
Hidden Techniques For Creating Chemistry Using NLP,NLP
can you undo a swish pattern?,NLP
"Nlp book recommendations, please also recommend an audio book thanks",NLP
"I'm addicted, can any NLP connoisseur help me?",NLP
Looking for a paper/testimonial of someone with a serious background in psychology who attended a NLP program.,NLP
"I've decided to learn NLP and I'm looking for a recommendation to enrol in Melbourne, Australia",NLP
Asking The Right Questions Can Change Your Life – Exploring The Meta-Model,NLP
I come from a destructive home and I want to change that.,NLP
Can anyone provide links to examples or analysis of NLP as used in real life?,NLP
"Hello, can anyone tell if this person is unintentionnally sending signals that involve deception or lies?",NLP
Need help with NLP Exercises,NLP
NLP-6b/11#Kiểm soát tư duy để có được cảm xúc tích cực,NLP
NLP-6c/11#-Sự liên kết tâm trí- cơ thể.,NLP
NLP-6a/11#-Bí quyết hành động kiên định.,NLP
Which one of these books for a beginner?,NLP
Beginner Here. NLP,NLP
Has anyone tried the Hypnotic Language Shortcut System from the Hypnosis Training Academy?,NLP
"I noticed that every time I sit down to study coursework, I immediately lose interest and end up doing something else",NLP
Transform Your Inner Voice by Pradeep Aggarwal,NLP
Kişisel Gelişim ve NLP konulu yazılar,NLP
Change Your State Of Mind Using NLP and Anchoring Techniques,NLP
A Word is Worth a Thousand Vectors,NLP
Please help me,NLP
What are the best videos and resources available to understand and learn NLP online? ( For free ),NLP
Remove Fear Of Public Speaking Using Simple NLP Techniques,NLP
Change Your State Of Mind Using NLP and Anchoring Techniques,NLP
Books to learn NLP,NLP
Positive thinking with a simple NLP anchor - Nature's Pathways Magazine,NLP
Can overall self behavior improvement be done with NLP?,NLP
Kikidan.com,NLP
How Effective is Hypnosis/NLP for Pain Relief?,NLP
Salespeople – Do You Use Your Own Product?,NLP
traditional nlp basics,NLP
Rollio Hiring: Lead Machine Learning/NLP Engineer (Cross Post),NLP
Help me with my communication,NLP
Know more about How to Structure Sales Incentives for Maximum Motivation,NLP
essential personality traits/qualities of a successful businessperson,NLP
nlp for beginners,NLP
The Truth About the NLP Page on Wikipedia,NLP
Is NLP really used by government secret agents as depicted in the movie Kingsman: The Secret Service?,NLP
free nlp training book,NLP
reasons to learn nlp,NLP
Has NLP helped you in your career?,NLP
Short video on the application of anchoring in the context of memorization. This series may go in to powerful inter/intra-personal applications of anchoring in future videos.,NLP
"NLP mentioned and exemplified in The Kingsman, a movie out tomorrow",NLP
A Consumer's Guide to Good Training* by Connirae and Steve Andreas,NLP
Free NLP Books,NLP
Becoming a better learner,NLP
Decisions and Commitment,NLP
A Nice Introduction To NLP,NLP
The Presuppositions of NLP – Why they are Important for Sales People,NLP
NLP for newbies (not great but good),NLP
NLP Basics By John David,NLP
A few questions about NLP,NLP
I heard NLP can be used as a form of psychotherapy?,NLP
Science Of Persuasion,NLP
Can NLP be used to improve memory?,NLP
How can you find out a person's meta-program through talking to them?,NLP
Train The Trainer,NLP
Motivation Skills For Managers,NLP
How to deal with manipulative person?,NLP
seduction and nlp: getting invited to her place,NLP
Giving away my NLP resources- yours if you'll actually use 'em,NLP
Are there any NLP forums that are very active?,NLP
6 Bad Habits To Guarantee You Suck At Cold Calling,NLP
Mneumonese--The Language of Memory and Logic : conlangs,NLP
AntalyaYaşam Koçluğu Eğitimi,NLP
Antalya NLP Practitioner Eğitimi,NLP
How with NLP techniques reach your 2015 targets in 7 steps!,NLP
NLP SuperFest in Melbourne - What is this??,NLP
The Ultimate course Offer,NLP
Time Line Therapy with Tasneem Kagalwalla,NLP
Techniques for Snoring using NLP???,NLP
Free NLP Practitioner and Associate Coach Program,NLP
Is it immoral to use NLP to seduce a woman?,NLP
Benefits of NLP Sales Training for Small Business,NLP
Unleashing The Power Of NLP For Building Confidence,NLP
How To use NLP Techniques In Sales,NLP
Your NLP Month - NLP Secret Strategies Revealed,NLP
1 month of FREE NLP in Business course on Udemy,NLP
Waking up in the morning,NLP
Question about NLP and Eckhart Tolle,NLP
Visualizing the completion of an objective and motivation,NLP
"Found a leading covert hypnosis product that teaching people how to hypnotize someone discreetly, without them knowing about it.",NLP
NLP for sales?,NLP
How Well Do You Feel,NLP
Conflict Solving Using NLP Practitioner Training,NLP
Pradeep Aggarwal's new course “Overcome Shyness Now Using NLP Techniques” can be availed for free using the coupon code - OSNUNT04 Or by simply clicking the link below - https://www.udemy.com/overcome-shyness-now-using-nlp-techniques/?couponCode=OSNUNT04,NLP
New course “Learn to Attract More Luck in Your Life Using NLP” can be availed for free using the coupon code - LAML03 in Udemy Or by simply clicking the link below -https://www.udemy.com/learn-to-attract-more-luck-in-your-life-using-nlp/?couponCode=LAML03,NLP
[PODCAST] How NLP Helps You In The Workplace With NLP co-founder Frank Pucelik,NLP
Is there collection of good reframes?,NLP
[Exclusive Interview] The Real History Of NLP Got Started With Frank Pucelik,NLP
[PODCAST] How To Model Superstars The Right Way Using NLP,NLP
Looking to learn,NLP
[PODCAST] How To Use NLP To Recover And Move Forward In Hard Times,NLP
Does anyone know of or have a utility to building a reddit corpus?,NLP
Who needs help with learning conversational hypnosis?,NLP
Excellency of NLP,NLP
The Best Use Of Google Hangouts Yet - NLP Superfest BrainLab with Judy Rees,NLP
Need NLP analysis of suspect in murder deposition,NLP
Context Specific NLP Uses and Benefits,NLP
NLP Weekly Topic #1,NLP
Systematically assimilating NLP,NLP
Revealed - NLP Co-Founder Goes Down Under,NLP
SECRETS OF BODY LANGUAGE,NLP
SECRETS OF BODY LANGUAGE,NLP
What is Neuro-Linguistic Programming (NLP)?,NLP
How to persuade,NLP
Reading recommendations for children,NLP
I'm pressed for time. Should I learn NLP?,NLP
Thoughts on becoming a NLP Practitioner?,NLP
Re-Program your Mind - The Ten Commandments of NLP,NLP
What NLP-format could help me?,NLP
"(NLP on Self) Problems adding or discerning sensory information to/from ""Beliefs"". Am I just crazy?",NLP
Interesting research on kinesthetic sub modalities with emotion. Mapping feelings in the body.,NLP
[Question] Do you know some psychological methods for oral presentations?,NLP
Ruby - Evolving Dictionary for Normaliser (NLP),NLP
Amazing Conversational Hypnosis,NLP
Chris Howard - Anyone ?,NLP
Where to do NLP?,NLP
Subliminal Suggestion to influence a person's choice of word from millions of possibilities,NLP
[not directly nlp] The best way to win an argument: how do you change someone’s mind if you think you are right and they are wrong?,NLP
I believe I've been programmed by a third party. (Serious),NLP
Classic/influential/hallmark papers in NLP,NLP
Confusing Accessing Cues,NLP
Techniques to find your purpose?,NLP
State manafement? How to control / maintain your state,NLP
What happens when it goes wrong?,NLP
NLP vs Science | NLP Practitioner Certification,NLP
Free Udemy course - 7 Scientifically Proven Steps to Increase Your Influence,NLP
NLP Leadership | NLP Practitioner Certification,NLP
OBSCENELY Powerful Neuro Linguistic Programming Techniques!,NLP
"Using memories to motivate future behaviour: ""Activating a positive motivational memory had a significant effect on students ’ self-reported exercise activity even after controlling for prior attitudes, motivation and exercise activity."" [PDF]",NLP
"This is a long post, I'd like to know if it's possible that the thought of money is an anchor for my bad mood in social get-togethers. Scroll to the bottom of my post for a TL;DR",NLP
Getting great at calibration,NLP
NLP & Leadership - How to overcome being perceived as a weak teamleader,NLP
Decided to try out NLP,NLP
Mengenal NLP (Neuro Linguistic Programming) | Yuki Yusman,NLP
How can I get ideas inside peoples head covertly..,NLP
"""Touch impacts the way we perceive the products and packaging we interact with on a daily basis because of the way we process information metaphorically.""",NLP
"The Science of Positive Thinking: ""positive emotions provide [] an enhanced ability to build skills and develop resources for use later in life""",NLP
"The Science of Positive Thinking: ""positive emotions provide is an enhanced ability to build skills and develop resources for use later in life""",NLP
PLOS ONE: The Motor System Contributes to Comprehension of Abstract Language,NLP
Mirroring -little question,NLP
Ultimate Selling Skill With NLP,NLP
Business Presentation Skill with NLP,NLP
What are the most common obstacles to mastering NLP?,NLP
Getting Unstuck: Powerful strategies for overcoming everyday problems,NLP
What did you feel after your NLP breakthrough?,NLP
Would burning incense every night before sleep anchor the smell as a sleep-trigger or get me hooked on it?,NLP
Program yourself!,NLP
"NLP - ""Because"" Language is Powerful - Jamie Smart",NLP
NLP and Facial Tics?,NLP
"John Grinder ""what is NLP? """,NLP
"""What is the best NLP book for beginners?""",NLP
I really wish this sub-reddit was more active.,NLP
"""10 Ways to Protect Yourself from NLP"" I stumbled upon this and thought it might be worth a chuckle and possibly a discussion.",NLP
Stumbled upon this and thought it might be worth a chuckle and possibly a discussion.,NLP
"State management - A Harvard psychology researcher explains that rather than thinking of success as the source of happiness, we should think of happiness as a source of success--and one that's more under our control than we imagine.",NLP
Scientists Convince People Their Hands Are Rocks - Inkfish,NLP
Number 1 Recommendation When Starting To Learn NLP,NLP
How to use Apple's NLP techniques to lose weight,NLP
Can NLP help you to loss weight?,NLP
Tony Robbins: Why we do what we do,NLP
Any suggestions for a good NLP course in the UK ? (preferably London),NLP
"""What is NLP Modeling and how does it work?""",NLP
HYPNOSIS AND NLP? DOES IT WORK?,NLP
Need help reconditioning association related to sex...,NLP
Why Goal Setting (So Often) Fails,NLP
NLPTimes: Free Resources,NLP
How To Create Learning Magic .. Training Design & Things You're Unlikely To Have EVER Heard Before,NLP
Part 1/4 - John Grinder on 'The Origins of NLP': The early days of NLP,NLP
'Secret Therapy' & How To Time Your Anchors Exactly…,NLP
"""Does doing NLP by yourself from a book actually work?""",NLP
"“If you can change your mind, you can change your life.” ~ William James",NLP
NLP Techniques: How to eliminate unwanted thoughts,NLP
"Tony Robbins UPW Explained, an NLP video analysis.",NLP
Mirroring behavior. What does it imply?,NLP
“Is NLP A Magic Bullet?”,NLP
What Is NLP? by Michael Carroll,NLP
"The little known ""Swiss Army Knife"" Tool of NLP",NLP
Neuro Linquistic Programming,NLP
Neuro Linquitic Programming and Covert Hypnosis,NLP
“Does NLP Work In The Long Term?”,NLP
"""It's not about how smart you are--it's about capturing minds.” ~ Richie Norton",NLP
Looking for NLP techniques to help me get motivated to do my work,NLP
NLP Techniques: How To Use NLP Effectively?,NLP
Does Apple use NLP? - The NLP Knowledge Centre,NLP
Getting Good With The Techniques of NLP: Fixate On Function & Repetition Then Go For Variety...,NLP
Any good recommendations on learning Tonality?,NLP
Would it be possible to be hypnotised to feel the effects of a drug indefinitely? [Serious],NLP
Top 5 Things You Always Want To Do When Using NLP,NLP
How To Use NLP In Business And Life From Master NLP Trainer & Hypnotist Barbara Stepp,NLP
Exclusive Gift - Deep NLP Interviews - Get Inside The Mind Of Some of The Best NLP Trainers Alive Today,NLP
"4 good links, 16 bad links on the NLP Sub. Mods, please help!",NLP
Learn Deep NLP Insights & The Inner Thinking Of Master Trainer Of NLP & DHE Gabe Gurerro,NLP
Exclusive Gift - Deep NLP Interviews - Get Inside The Mind Of Some of The Best NLP Trainers Alive Today,NLP
NLP Exercise to Stay Motivated,NLP
Exclusive Gift - Deep NLP Interviews - Get Inside The Mind Of Some of The Best NLP Trainers Alive Today,NLP
NLP Times | Help Spread The Word!,NLP
Exclusive Gift - Learn Deep Insights Into NLP From A Renowned Master Trainer,NLP
Exclusive Gift - Deep NLP Interviews - Get Inside The Mind Of Some of The Best NLP Trainers Alive Today,NLP
NLP TIMES | Mastering NLP Anchoring Free E-Course,NLP
