title,subreddit
Sleight of Mouth,NLP
Can anyone help me understand this question,NLP
5 NLP Sports Coaching Questions (Clifford Stark),NLP
The 12 Rules of Life Mastery ( Master Practitioner Level ),NLP
Presuppositions Of NLP 2.0 Episode 4 - event link in comment,NLP
Modelling Project Presentations,NLP
How to resolve a conflict in 5 mins,NLP
Perception and Gratefulness,NLP
NLP as alternative treatment for schizophrenia.,NLP
NLP with Aphantasia ( I can't create mental pictures),NLP
Techniques/Features to quantify journalism quality,NLP
How to resolve a conflict in 5 mins,NLP
Presuppositions of NLP2 0 Episode 3,NLP
The Sales and Game (NLP and Selling),NLP
Advanced Negotiation Skills & Strategies,NLP
Materials on Knowledge extraction,NLP
Executive Leadership,NLP
Sometimes we need to take a deep meditation without thinking about the past and future situation.,NLP
"A small, a bit silent community ...",NLP
What is NLP,NLP
NLPs Clever Hans Moment has Arrived,NLP
Reframing Bad Emotional States,NLP
Bored in life and thinking about doing an NLP course - any tips?,NLP
You cannot step twice in the same river | DorisNLP,NLP
Feelings and Emotions |dorisnlp,NLP
"Vergeben, Verzeihen, Vergessen",NLP
NLP Foundation &amp; NLP Master,NLP
Certified NLP Program in Dubai,NLP
The Presuppositions Of NLP2.0 - Episode 2,NLP
"Hypnosis, Finally explained | Ben Cale | TEDxTechnion",NLP
The secret codes,NLP
Decently priced weekend trainings/classes? I don’t like online learning btw.,NLP
The Presuppositions Of NLP 2.0,NLP
"Questions That Uncover Hidden ""Motives""",NLP
"Negative Self Talk * What it is, isn't, and how to Shift",NLP
Approach anxiety and general attraction,NLP
Anchoring myself,NLP
Patience | Dr. Doris NLP Master Trainer & Master Coach,NLP
Submodalitäten: Assoziiert / Dissoziiert,NLP
Derek Rake,NLP
Conscious Training Of The Unconscious Mind?,NLP
German Political Speeches Corpus and Visualization,NLP
Should I learn hypnosis or nlp first?,NLP
Fantastic testimony to the power of NLP and Time Line Therapy(R),NLP
NLP Trainers Training,NLP
Anchoring help,NLP
NLP TRAINERS TRAINING TIPS,NLP
Aren't you bothered by the posts about Natural Language Processing?,NLP
How to bring NLP into exterior/interior spaces?,NLP
The Presuppositions of NLP 2.0 Live,NLP
Reality,NLP
11 rules that change my life,NLP
Advice You Didn’t Know You Needed To Hear,NLP
Is self hypnosis effective?,NLP
Intro books,NLP
NLP Metaprograms - Episode 21,NLP
Fear of Cancer Therapy,NLP
Transforming self sabotage into success,NLP
Belief Change - what to do if you can't elicit a picture,NLP
noob,NLP
Ericksonian Hypnosis book up for grabs - selling off more of my way-too-large library of NLP & Hypnosis stuff,NLP
A Date With Excellence - Live From David's House - webinar link in comments,NLP
Being Pushed Out Therapy,NLP
12 Key things to motivate and persuade an audience webinar. Link in comment,NLP
Intuition: Höre auf Dein Bauchgefühl,NLP
The Brilliance of NLP Streamlines Daily Life of Tech-Accustomed People | Analytics Insight,NLP
How do you trick yourself to become naturally confident?,NLP
Mirroring and matching question,NLP
Some NLP Books Light on the Jargon?,NLP
What causes binge eating disorder and How NLP can help with binge eating | Infographics | Matthew Tweedie Hypnosis,NLP
An amazing nlp technique to kill your cravings.,NLP
“The Rainbow Machine – Tales from a Neurolinguist’s Journal” by Andrew T. Austin for less than 1 pound for a limited time only.,NLP
Immer gute Laune haben – Wie geht das?,NLP
Looking for real life NLP Success stories,NLP
Why don't people believe NLP?,NLP
Advanced books suggestions,NLP
Question to Elicit Core Value,NLP
💙Design Your Paradigm Eutaptics Certified Tapping Coach EFT/NLP Certified 💙,NLP
Atem ist Leben!,NLP
Good introduction articles to NLP...[not mine],NLP
Please interpret,NLP
Why does Wikipedia say NLP is not scientific? What’s some important concepts on Neuro Linguistic Programming one should know ?,NLP
Many Bandler/Grinder Early NLP Developer Videos for sale,NLP
There should be a HUGE banner saying Neuro Linguistic Programming to lessen the confusion with natural language processing. Please upvote so the mods see it.,NLP
Rare Richard Bandler Video Set - if anyone's interested. More info in comment below.,NLP
RAS and Meta Programmes,NLP
Ohne Worte: Nonverbale Kommunikation!,NLP
Robert Lifton on destructive cults,NLP
NLP for becoming open/stopping limiting beliefs to romantic relationships,NLP
Loving Core Transformations... other recommendations?,NLP
Help with the correct and complete MP3 of Tape 7 of the following,NLP
Past: A picture is worth a thousand words! Present: A word is worth a thousand pictures!!,NLP
Free NLP webinar with David Shephard,NLP
Questions about a project.,NLP
Extract medical data from journal,NLP
3 Schritte: Komm in den FLOW-Anleitung,NLP
NLP 2.0,NLP
[INTERVIEW] How To Solve The Biggest Problem For All NLP Coaches,NLP
Emotional Intellegence A Tool For Mental Stability,NLP
Neuro-linguistic Programming For Dummies is 32% off,NLP
🔥 [INTERVIEW] How to Achieve Lasting and Positive Change,NLP
How To Speak Like A Leader In A Meeting,NLP
I've heard mixed Reviews of the efficacy/realness of NLP...,NLP
Techniques,NLP
FLOW – Fokus und Glücksgefühl,NLP
Public Speaking in Malaysia | NLP Courses Malaysia | Corporate Trainings Malaysia | Leadership Program Malaysia | NLP Courses,NLP
Self Pacing & Leading ?,NLP
How do/did you practice NLP?,NLP
Looking for Derek Rake products ( Primarily texting on steroids 2.0 ).,NLP
Sound familiar and/or like NLP? Aspergers man possibly using some Seduction/manipulation techniques or else I am paranoid and delusional,NLP
NLP Material,NLP
NLP Metaprograms - Episode 20 - Attention Direction,NLP
Free event! https://go.performancepartnership.com/sex-money-power,NLP
"Sex, Money, Power - Meet NLP 2.0, the complete solution that energises and empowers your body, heart and mind",NLP
books on NLP,NLP
What's the best technique to tackle flying phobia rooted in lack of control?,NLP
Did my therapist try anchoring in my session?,NLP
Where to begin using NLP from?,NLP
OVERCOMING DEPRESSION | NLP PATTERN INTERRUPTS WEBINAR | LIFE COACH | JAMES PESCH | KINESTHETIC MAP,NLP
NLP Based Phobia or FEAR Cure,NLP
eye accessing cues- are there any besides the typical ones?,NLP
Forgetting to use NLP in everyday life,NLP
NLP Metaprograms - Episode 19 - Modal Operator Sequence,NLP
Can NLP not work in other Cultures?,NLP
Need name of floor exercise used to change a limiting belief.,NLP
NLP Master Practitioner & NLP Master Coach,NLP
Einfach mit dem Rauchen aufhören,NLP
NLP Metaprograms - Episode 18 - Time Storage Filter,NLP
Why doesn’t Neuro-Linguistic Programming give this subreddit to Natural Language Processing?? It is far more popular and I am tired of commenting “wrong sub” on posts,NLP
"Any NLP tricks to visual anchoring,",NLP
NLP Hypnosis,NLP
what is nlp?,NLP
NLP Techniques,NLP
How to be socially confident in my native language?,NLP
Get a summary of virtually anything in seconds with SummarizeBot,NLP
NLP Metaprograms - Episode 17 - Emotional Stress Response,NLP
NLP Secrets of Influence and Persuasion – Part 2,NLP
NLP Techniques | 85 Essential Neuro Linguistic Programming Techniques,NLP
Is it normal to oppose against everything that is suggested to someone?,NLP
NLP Secrets of Influence and Persuasion,NLP
NLP Metaprogramme 9: Autoritätskriterien,NLP
NLP Metaprograms - Episode 16 - Relationship Filter,NLP
ICF Accredited Coach Training in India,NLP
Predict what DJT was about to say based on his past public statements ?,NLP
NLP Techniques,NLP
NLP Training in Bangalore,NLP
Neuro Linguistic Programming,NLP
Best nlp trainer,NLP
L. Michael Hall books read in order?,NLP
NLP Training in India,NLP
"Let’s take it offline | Brain, Mind and Language",NLP
NLP Trainer Course in India,NLP
Ideas needed,NLP
NLP Metaprogramme 8: Notwendigkeit / Annehmlichkeit,NLP
NLP Metaprograms - Episode 15 - Chunk Size Filter,NLP
NLP Metaprograms - Episode 15 - Chunk Size Filter,NLP
Looking to do a PhD In CS with NLP as main core,NLP
NLP pricing. Help a sista out.,NLP
What might be wrong with this picture?,NLP
Looking for suggestions,NLP
A banner change is needed on this sub,NLP
NLP for search engine optimization purposes,NLP
Was ist Hypnose und wie funktioniert sie?,NLP
NLP Metaprograms - Episode 14 - Work Affiliation Filter,NLP
Latest update on the Netflix Of NLP,NLP
"Sex, Stalking and NLP Training",NLP
Catatrophisation,NLP
NLP Training in India | NLP Trainer Boot Camp,NLP
NLP Entscheidungshierarchie für Deinen gesunden Körper,NLP
Suggest the best algorithm to use.,NLP
NLP Metaprograms - Episode 13 - Work Affiliation Filter,NLP
NLP Metaprograms - Episode 12 - Action Filter,NLP
NLP Metaprogram - Episode 11 - Management Direction Filter,NLP
NLP and Unemployment,NLP
"NLP Coaching India, Life Coach | Insight Life Coaching",NLP
First CD of NLP Practitioner home study program for FREE!,NLP
Loads of free NLP/hypnosis downloads,NLP
Do you know the difference between NLP and Hypnosis?,NLP
NLP Metaprogramme 7: Proaktiv – Reaktiv,NLP
Best Anil Thomas NLP Training In Mumbai,NLP
NLP Metaprograms - Episode 10 - Convincer Demo,NLP
Better NLP (experimental),NLP
Boost Your Self Confidence - Hypnosis,NLP
NLP Master Practitioner - Salus Academy,NLP
Mirroring & Matching | NLP Sensory Acuity | Emotional Intelligence,NLP
"There is No Failure, ONLY Feedback.",NLP
:),NLP
Deloitte Legal Holds NLP Challenge To 'Understand' Legislation,NLP
NLP Metaprograms FREE download.,NLP
NLP Metaprograms - Episode 9 - Convincer Representation,NLP
NLP Metaprograms - Episode 8 - Frame Of Reference,NLP
NLP and Hypnotherapy Courses - Salus Academy,NLP
Mindfulness and success in business,NLP
Pacing & Leading | NLP | Persuasion & Influence,NLP
"If charisma can be taught, why are so many NLP experts so awkward?",NLP
What is anxiety? How to overcome anxiety?,NLP
Is empathy logical in Coaching?,NLP
How the FBI uses NLP on YOU | Neuro-Linguistic Programming,NLP
Suggestions on removing a mental block,NLP
HMS Therapist Training Cornwall,NLP
Vom Pessimismus zum Optimismus,NLP
"Mind-Reading: Avoid This Common Trap to Improve Your Communication Skills - ""In psychology, mind-reading is when we try to infer what is going on in someone's mind without asking them to clarify. It's a common trap in relationships that often leads to miscommunication and misunderstanding.""",NLP
The Problem with Negation Words,NLP
NLP Metaprogramme 6: Probleme vermeiden / auf Ziele hin ausrichten,NLP
NLP Metaprograms - Episode 7 - Reason Filter,NLP
Best books/courses to learn NLP?,NLP
[Ideas] Framework for studying code mixing,NLP
Conversational Interfaces:The Future of UI [+6 Use Cases],NLP
Hypnosis and Subconscious: the KEY to Changing Your Life,NLP
Will anchoring bring back a memory or a mental state?,NLP
How can I find a NLP 1-on-1 coach thats not an online coach?,NLP
"[trade]looking for Derek Rake's Shogun Sequences 2.0, Shogun Sequences Over Text 2.0 and Reseduction 2.0",NLP
Perfektionismus – muss das sein?,NLP
Group Anchors?,NLP
NLP Metaprograms - Episode 6 - Motivation Direction,NLP
PART 2 DAMON CART OF NLP GYM | NEUROLINGUISTIC PROGRAMMING | PHILOSOPHY | SELF HELP| MIND MASTERY,NLP
Positive Intent: Everyone is Always Doing Their Best ⋆ James Pesch NLP Presuppositions,NLP
A Conversation with Damon Cart | NLP Gym,NLP
the FASTEST THERAPY IN THE WORLD FOR addiction PART 2,NLP
The Fastest Therapy for Addiction in the World PART 1,NLP
How To Communicate Using Hypnotic Language Without Fear? - Masterclass,NLP
WHAT IS EMOTIONAL INTELLIGENCE | SENSORY ACUITY NLP | MIRRORING & MATCHING | EYE MOVEMENTS LIFE,NLP
What is NLP?,NLP
The NLP Metaprograms - Episode 5 - Adaptation Operator,NLP
NLP Master Class tomorrow! Register for The Free Masterclass How To Communicate Using Hypnotic Language Without Fear,NLP
The Foundations Of “Hypnotic-Based NLP”,NLP
2 Minute Stress Release Therapy,NLP
"Can covert NLP in other persons be noticed, even if they never heard of it before?",NLP
Mehr Charakterstärke für Dich,NLP
BODY CONFIDENCE HMS THERAPY,NLP
Well Formed Outcomes,NLP
Meta Models of Reality,NLP
Request for advice on habit / compulsion removal,NLP
NLP Metaprograms - Episode 4 - Internal State,NLP
Neuro-Linguistic Programming - The Difference that Makes the Difference.,NLP
Fear of Success HMS Therapy,NLP
Any feedback on Mike Bundrant's Master Practitioner Training through iNLP?,NLP
NLP and anxiety,NLP
NLP Coaching - ChangeWorx,NLP
Some help of Implementation of TextRank ALgorithm...,NLP
GET PAID MORE Self Worth Therapy,NLP
NLP Magick - learn why the first book about NLP was called The Structure of Magic,NLP
Bad memory - how to 'delete'?,NLP
NLP Metaprogramme 4: Überblicksortierer / Detailsortierer,NLP
Coaching session using NLP,NLP
NLP Metaprograms - Episode 3 - Internal Process,NLP
Free NLP Course - Salus Academy,NLP
My thoughts on NLP,NLP
Shannon.AI’s Glyce Masters 13 Chinese NLP Tasks,NLP
Building a Better Profanity Detection Library with scikit-learn,NLP
Guidance to help a friend overcome anxiety?,NLP
FREE NLP Introduction CD from David Shephard,NLP
NLP Metaprograms - Episode 2 - External Behaviour,NLP
"Kinder, wie die Zeit vergeht!",NLP
Do you need more clients?,NLP
New to NLP – Reading material/exercises to overcome stress/anxiety when interacting with people,NLP
NLP Metaprograms Episode 1,NLP
NLP Metaprograms Episode 1,NLP
NLP Fans,NLP
Tech Giants Experiment Potency of NLP; Assay for Potential Applications of Technology,NLP
Interner Dialog: Folge Deiner inneren Stimme,NLP
A comprehensive guide to NLP,NLP
Having a practitioner in NLP is like...,NLP
Tips from a not-for-profit standard early adopter - nlpcoach,NLP
NLP and Hypnotherapy Practitioner - Salus Academy,NLP
What are some good Python libraries for text summarisation?,NLP
Integrative NLP & Hypnotherapy - Salus Academy,NLP
Integrative NLP & Hypnotherapy - Salus Academy,NLP
NLP Therapists in Melbourne (Australia),NLP
NLP Learning Series: Text Preprocessing Methods for Deep Learning,NLP
NLP Business Development. Beat Your Sales and Revenue Targets,NLP
Best Executive Coach in India - Vikramdhar,NLP
ICF approved Coach Program - NLP Coaching Academy,NLP
[TRADE]I have all of DEREK RAKE's products,NLP
How well might the RRG and Patom approach to NLP compete with state of the art machine learning methods?,NLP
NLP Metaprogramme 3: Zufallssortierer / Sequentialsortierer,NLP
"NLP resources that are a little more rational and less ""feel good""?",NLP
Students Realign Their Brains with NLP Life Training,NLP
Hypnose #4: Posthypnotische Suggestionen und Aufwecken,NLP
Video: Client Session - resolving fear of flying (Trailer),NLP
Best NLP Training in India by Transhuman Consulting,NLP
"""7 Steps for a Guilt-Free 2019"" — Inspired by Steve Andreas' regret resolution pattern",NLP
Leadership Coaching by the Best NLP Trainer in India | Transhuman Consulting |,NLP
Derren Brown:Tricks of the mind.,NLP
NLP Training in India – 5 Most Important Reasons why NLP Training Fails in India,NLP
Can the moderators help clarify the purpose of this sub? Lately there have been as many posts about Natural Language Processing as there are about Neurolinguistic Programming.,NLP
"Need help with reparenting a memory and/or believe, any skilled practitioners able to help me over the phone or video chat?",NLP
Finding a state of mind - need your help,NLP
Hypnose #3: Die Trance Utilisierung,NLP
Some Anchoring and a little bit of Neuroscience,NLP
NLP Techniques To Get What You Want: Rewire Your Mind,NLP
Worst Case und Best Case Sortierer,NLP
Get Live NLP Training at Symbiosis Coaching,NLP
NLP Training at Symbiosis Coaching,NLP
Photo Reading - Have you seen anyone demonstrating this ability?,NLP
"Resolving ""I don't belong"" in one session + followup - Decision Destroyer",NLP
What are some good subreddits to practice asking meta model questions?,NLP
Does anyone else use physical triggers for emotional states?,NLP
Anchoring,NLP
Persuasive material,NLP
Sleight Of Mouth Patterns and Communication Patterns in Psychiatric Settings,NLP
how to tell if an assertion is common sense knowledge?,NLP
"Self-Awareness and Behavioral Patterns: Generalization, NLP | Psychology...",NLP
Can I self study an intro course?,NLP
Accidental post-hypnotic suggestion,NLP
I need your help fellow NLP practitioners,NLP
Since the sub is kinda slow (dead?) I'll post my own personal NLP strategy that has helped me out. Hope it can help another :),NLP
The social politics of the NLP scene,NLP
"Black Friday: Kaufen, bis die Schwarte kracht?",NLP
CREATING A WINNERS MINDSET | INTENTIONAL PREFRAMING | NLP | LIFE COACH |...,NLP
"Recursive Frame Analysis on ""One Flew Over the Cuckoo's Nest""",NLP
"Are you interested in NLP and want to start learning more with Tutorials? Check out this new Youtube Channel, called Discover Artificial Intelligence. :)",NLP
NLP Certification,NLP
On the issue of guilt,NLP
"The ""tea or coffee?"" bind.",NLP
Masters Of Influence now available online!,NLP
Requesting free video resources to learn NLP,NLP
Online NLP Resource,NLP
NLP Strategy for Prepping for Fasting.,NLP
Mindfulness,NLP
Self Point: Isn’t it Super Obvious?,NLP
102 Neuro-Linguistic Programming eBooks,NLP
"How Can Derren Brown Do This? Is This Hypnotism, NLP,Suggestion? Is Derren Just Rearranging This Man's Thought Patterns? Brown Seems Like He Can Do What Therapists Try To Do In A Matter Of Minutes.",NLP
Which Milton Erickson book?,NLP
NLP for stressed teachers,NLP
NLP training in education,NLP
NLP for Educators,NLP
How valid and proven is NLP? Where to learn?,NLP
hypnotherapy hertfordshire,NLP
nlp hertfordshire,NLP
nlp for confidence north london,NLP
Neuro Linguistic Programming Techniques for Self Acceptance,NLP
Aufschieberitis ist nur die eine Seite,NLP
Happy Halloween from the Power Family and yeah we can fly -,NLP
"Deliberate use of words such as ""opinion"" and ""certainty""",NLP
"Courses, scams?",NLP
Universal Body Language,NLP
NLP| Trans human consulting,NLP
NLP Techniques for Developing Your Auditory Sensory Acuity,NLP
Pattern Interrupts: Interrupt Emotional Triggers,NLP
Affordable internationally accredited online NLP course,NLP
Superb moments are more exciting when we get to share !,NLP
NLP Programs,NLP
Best NLP pattern for weight loss?,NLP
"Since this day , I have developed a multi million dollar company , saved untold numbers of lives and continue to thrive and cause happiness and life all over America . I have also assisted my own children through difficulties and teen years with excellent results . Thank you Kelly Dunn for this gift",NLP
Persuasive Writing Result!,NLP
Share Optimism frames,NLP
"Pacing & Leading is a Powerful Tool that you can use to communicate & to help positively influence others, enjoy!",NLP
Get Certified Diploma in NLP & Psychotherapy - The Salus Acdemy,NLP
Neuro Linguistic Programming,NLP
"This subreddit is for ""Neuro-Linguistic-Programming""",NLP
How NLP can change your life,NLP
Hast Du Angst vor Ablehnung?,NLP
Looking for NLP Training and Courses in Mumbai,NLP
Focus! Focus! Focus! - Romal Surana,NLP
4 Schritte: Lerne aus allen Fehlern,NLP
"I’m pretty sure my girlfriend has been covertly manipulating me. When she does things a certain way, I think a certain thing? What are your thoughts? I can I recognize and protect against this type of thing?",NLP
Hypnosis/NLP To Manifest Romantic Relationships Using The Law Of Attraction,NLP
Online MASTER CLASS - WELL FORMED OUTCOME: GOAL SETTING - Develop an understanding of what you want and how to get that. * GOAL GETTING PROCESS - How to create step-by-step plan to reach to your outcome MAPPING ACROSS aka LIKES TO DISLIKES REFRAMING SWISH PATTERN,NLP
Best scientific books to know more about NLP?,NLP
What are big publicly downloadable categorical grammars for the English language?,NLP
What is this I've discovered,NLP
NLP Certification,NLP
WHAT IS EMOTIONAL INTELLIGENCE | SENSORY ACUITY NLP | MIRRORING & MATCH...,NLP
How closely related is the ability to do nlp naturally and being a sociopath?,NLP
Alles für mehr Gesundheit und Lebenskraft,NLP
Hierarchical Attention Networks for Document Classification with web demo (Pytorch implementation),NLP
Nice to meet,NLP
[Please help] Can you use NLP to change mental associations with music and songs?,NLP
NLP Question,NLP
"I recenlty had the honor of teaching • Mapping Across, • The Swish Pattern, & • Reframing to break Unwanted Habits to a group of Powerful Counselors & Therapists at Improving Lives Counseling Services, Inc. in Tulsa Oklahoma. This is the first part (Mapping Across) of this Workshop *edited",NLP
Any of you have experience with online guidance?,NLP
Audio books,NLP
How Does The Law Of Attraction Works! By Romal Surana,NLP
best nlp trainers in india,NLP
The importance of business-centric NER,NLP
How does NLP work?,NLP
Drawing a blank on what NLP technique this is called.,NLP
The essential guide to NLP,NLP
Was sind Glaubenssätze?,NLP
Best Hypnotherapy Sessions for you in Nashville TN,NLP
The Power of Forgiveness! - Romal Surana,NLP
How to use NLP with Bereveament and get amazing results,NLP
The Power of Forgiveness! - Romal Surana,NLP
A-Z Of NLP Techniques and where to find them in books and trainings,NLP
Conscious and Subconscious Mind - Romal Surana,NLP
Power Of Positive Thoughts!,NLP
Das Dilemma Deiner Unzufriedenheit,NLP
Eye Accessing Cues 🙄😔🧐😶👀,NLP
Verändere Deinen Fokus:Verändere Dein Leben!,NLP
NLP CENTER IN DELHI NCR,NLP
The Power Of Positive Thoughts!,NLP
MIRRORING & MATCHING NLP | MINDFULNESS | NEURO-LINGUISTIC PROGRAMMING SELF HELP | PERSONAL GROWTH,NLP
Powerful Nlp session for self esteem,NLP
How to reprogram your subconscious mind every minute of the day,NLP
Is there any way to alter predictable behavior?,NLP
Havening an NLP Technique for Treating PTSD & Trauma,NLP
A change in perspective can change your life!,NLP
WHAT'S THE PROBLEM? | NLP 6 STEP REFRAME,NLP
How to deal with misspelling/jargon out-of-vocabulary words with social media text when using word embeddings for CNN classifier.,NLP
5 NLP Questions that remove pain,NLP
THE BEST 5 NLP QUESTIONS,NLP
3 ways to stop sabotaging yourself,NLP
SLEIGHT OF MOUTH: POWERFUL NLP TECHNIQUE,NLP
Is that possible to access LDC dataset like ontonotes-5.0 if my school is not a member?,NLP
I'm Online Now,NLP
The Netflix of NLP and Personal Development!,NLP
Advice Wanted: Most useful exercise/information,NLP
How I got unlimited confidence in every area of my life...,NLP
Positive Thinking = Depression | Cognitive Action > Positive Thoughts | NLP,NLP
[SELLING] [WITH PROOF] David Snyder - Self Mastery Supercharger.,NLP
NLP Anchoring: What it is | Why it Works | How to do it,NLP
LDC is expensive,NLP
Unleash Your Inner Hero!,NLP
Please read,NLP
Huge Collection of Courses,NLP
SIRHUD KALRA FRIENDZONE,NLP
NLP techniques to get paid more.,NLP
Anyone need any NLP or Persuasion programs for cheap prices DM me.,NLP
Live NLP Training by Symbiosis Coaching,NLP
How We Create & Maintain Beliefs,NLP
HOW TO CREATE & REACH GOALS | QUICKFIX MIND SHIFT STRATEGY | NLP DEMO | ...,NLP
SELF HELP MAPPING ACROSS | NLP MIND SHIFT STRATEGY | DOUBT & CONFIDENCE ...,NLP
SELF HELP | PERSONAL DEVELOPMENT REFRAMING | STOIC PHILOSOPHY | NLP | CO...,NLP
"SELF HELP | NLP SWISH PATTERN | CHANGE BELIEF, HABIT, BEHAVIOR | MINDSET...",NLP
The Swish Pattern,NLP
SELF HELP WORKSHOP | PERSONAL GROWTH & DEVELOPMENT | MIND SHIFT STRATEGY...,NLP
SELF HELP WORKSHOP | PERSONAL GROWTH & DEVELOPMENT | MIND SHIFT STRATEGY...,NLP
Leader’s Guidance for Your Business Development,NLP
Impact of Business Coaching Over Your Marketing Strategy,NLP
Use NLP to Get Rid of that Annoying Song in Your Head,NLP
Dilts' Logical Levels,NLP
Dilts' Logical Levels,NLP
Find A Key Factor of Measurable Business Solutions,NLP
Behavioral Pattern purview on The Basis of Personality Development,NLP
5 Things Confident People Do,NLP
How Meditation Can Make You Emotionally Stable,NLP
nlp is a great tool,NLP
NLP Discord,NLP
Understand Strategies to Make Better Decisions,NLP
NLP practitioner certification by master trainer Sushil Mehrotra in Pune,NLP
Any NLP discord channel out there?,NLP
NLP Practitioner Certification in Pune,NLP
Remove Old Habits and Unwanted Feelings,NLP
NLP Practitioner Certification in Pune,NLP
NLP Practitioner Certification in Pune,NLP
How to Overcome Interpersonal Conflict,NLP
How can we change the negative beliefs of a friend to a better ones ?,NLP
NLP practitioner certification by master trainer Sushil Mehrotra in Pune,NLP
How to be completely congurent when creating your goals,NLP
Request for clarification,NLP
Are You Hungry? ⋆ James Pesch,NLP
How to Improve your Life Style,NLP
FREE NLP TRAINING,NLP
The Science Behind Relationship Investment,NLP
How Anger and Low Self-Esteem can Boost your Competitive Drive,NLP
3 Ways To Practice Your NLP Skills,NLP
Went to a NLP meetup - got the feeling I was being conned?,NLP
anyone nlp....?,NLP
Belief in Yourself: Mirror Neurons & Modeling,NLP
A Classifier to Distinguish Between Cypriot Greek and Standard Modern Greek,NLP
Love is not an act it is state of being,NLP
The Basic Principles of Language,NLP
NLP tranceactional field,NLP
NLP transeactional field,NLP
How to handle premature ejaculation with NLP,NLP
A Complete Life Coach Certification by a Superior Master Trainer in Delhi,NLP
How to Live Life King Size,NLP
Ban,NLP
Benefits of Business Coaching for your Business,NLP
HOW TO MODEL SUCCESS,NLP
Changing sub modalities on live,NLP
