title,subreddit
Have you started applying NLP to your Love life?,NLP
"""other modal"" equivalents for this phrase?",NLP
Why Life Coach Certification is Mandatory for Motivation,NLP
"Use Nlp Tools by Joining Practitioner Certification in Delhi, India",NLP
A True Realization Of Life Coaching In Bangalore,NLP
A True Realization of Life Coaching by Sushil Mehrotra in Delhi,NLP
Who am I?,NLP
Allowing Yourself to Be Intentional,NLP
Having a Team Mindset - Visualization Technique,NLP
NLP Master Practitioner Certification by Sushil Mehrotra in Delhi,NLP
A Complete NLP Master Practitioner Certification in Delhi,NLP
Join An Effective NLP Master Practitioner Certification in Delhi,NLP
NLP Master Practitioner Certification by Sushil Mehrotra,NLP
NLP Master Practitioner Certification from WisdomTree Solutions,NLP
Join the NLP Master Practitioner Certification in Delhi,NLP
RSVP to Receive the First 10 Lessons for FREE upon next week's launch!,NLP
Life Coach Certification in Delhi By Sushil Mehrotra,NLP
Putting the missing pieces in puzzled life through NLP,NLP
NLP Master Practitioner Certification by Sushil Mehrotra in Delhi,NLP
I need to feminize my voice,NLP
TWO CERTIFICATES – NLP Master Practitioner Certification & ADVANCED LIFE COACH,NLP
NLP Practitioner Certification in Delhi,NLP
"Date Extended June 05, 2018: 10th International Conference on Intelligent Human Computer Interaction (IHCI 2018)",NLP
Why perplexity has that correlation,NLP
life coach pune .Join us in pune,NLP
How to choose the best life coaching in Mumbai,NLP
Hypnotherapy Training in North London - Salus Academy,NLP
Stop Negative Self Talk,NLP
Get Life Coaching Certification by Sushil Mehrotra,NLP
Increase your Business with Business Coaching,NLP
Where do our beliefs come from?,NLP
"International Dialogue Education Associates, Inc.'s New NLP APP: https://www.facebook.com/InfluencingWithIntegrity/",NLP
Pre-Launch: NLP App with Free Trial,NLP
Recorded NLP sessions?,NLP
Fear of heights quick fix?,NLP
nlp training,NLP
Removing a Phobia of Flying,NLP
In this video I talk about 2 nlp techniques I use to stop my negative thinking,NLP
ARE YOUR BELIEFS LIMITING YOU?,NLP
Why could Knowledge graph benefit Question answering or Chatbot? and how?,NLP
Why does Knowledge graph benefit Question answering or Chatbot? and how?,NLP
The NLP Communications Model explained.,NLP
"New to NLP, discord link broken",NLP
NLP PREFRAMING | THE SECRET OF THE HIGHLY SUCCESSFUL,NLP
HOW TO DEAL WITH A BULLY | NLP REFRAME,NLP
Reframe It!,NLP
NLP Anchoring and drugs,NLP
How to stick to your goals,NLP
✋How to Stop Binge or Emotional Eating🚀,NLP
Help with embedded commands please,NLP
How to STOP Binge Eating,NLP
NLP in New York,NLP
HOW TO LET GO OF A TOXIC PERSON | SITUATION | LEAVE NEGATIVE PEOPLE | MI...,NLP
NLP Training is beneficiary in the professional life,NLP
Emotional Intelligence Certification in Mumba,NLP
Is there any information about the statistical significance of the performance for word embeddings?,NLP
HOW TO BECOME MORE PERSUASIVE | INFLUENTIAL | CONVINCING | NLP | MIND SH...,NLP
Looking for a Discord server on NLP,NLP
NLP Practitioner Certification – Mumbai,NLP
WHAT INSPIRES US? | MIRROR NEURONS | PATTERN & MIND SHIFT STRATEGY | NLP...,NLP
MIRROR TECHNIQUE | HOW TO BREAK SUBSTANCE ABUSE | HABITS | DIET EXERCISE...,NLP
When NLP turns baaad.....,NLP
HOW TO READ EYES | INFLUENCING HUMAN BEHAVIOR | MENTALISM | LINGUISTICS...,NLP
Focus on what you want,NLP
NLP Practitioner Certification in Goa by Doris Greenwood,NLP
What Qualities Make Common Man a Good Leader,NLP
How to indirectly mirror someones breathing while i am speaking?,NLP
How to Become Elite NLP Practitioner,NLP
HOW TO CURE FEAR & PHOBIAS | NLP | REMOVE FEAR | CURE PHOBIA,NLP
HOW TO GAIN CONTROL IN 3 STEPS | NLP | SELF HELP | JAMES PESCH,NLP
How to change yourself.,NLP
Overcome premature ejaculation by anchoring the time of ejaculation,NLP
Sources of NLP for absolute beginners?,NLP
"What Milton model books, websites do you recommend voor an NLP practitioner?",NLP
HOW TO GAIN TRUST using Cold-Reading & Barnum Statements in 4 EASY STEPS,NLP
How to Get Rid of Inferiority Complex with NLP,NLP
Do You Need Life Coaching,NLP
Become a Certified NLP Trainer with Trainer Training Certification,NLP
My Very Own NLP Personal Transformation Story,NLP
"How NLP master coach certification, is useful to us?",NLP
Explore the skill set by NLP master practitioner in Goa,NLP
An absolute NLP trainer training to become a reputed tutor,NLP
How to Spot the Ideal Life Coach,NLP
Entrepreneurship: A New Start of Your Dreams,NLP
How to Fix Self Identity Crisis Through Hypnosis Training,NLP
Four Unparallel Benefits of Business Coaching,NLP
Great Leaders Lead Their Team in Great Way!!,NLP
How Business Coaching Can Help You Grow the Business,NLP
Does Media Makes Us Feel Bad About Our Body,NLP
Help on update on different feature extraction method in NLP,NLP
A Psychological Tool: NLP,NLP
What techniques do people like Tony Robbins use in their work?,NLP
How to get a radical change through Nlp Training in India?,NLP
Why is NLP certification needed for your career perspective?,NLP
NLP certification by highly skilled professionals in Delhi,NLP
Which are the best patterns to improve learning? Are there any specifically designed for language learning?,NLP
Master NLP with Master Coach Certification,NLP
How does one improve results from Amazon Comprehend?,NLP
NLP useful skill to learn to teach kids under 5? im thinking of taking a nlp class in nyc,NLP
not sure if the NLP specialist I'm seeing it very good or very bad...,NLP
Fun with spacial anchoring.,NLP
(Request)David snyder - Real world hypnosis full product,NLP
Using presupposition in affirmations?,NLP
Making a Statement That Bypasses and Makes You Assume Something is True?,NLP
Thomas Björge's Guide to the Third Position,NLP
NLP as a Personality Development Training,NLP
Emotional Intelligence 3 - 7 March Bangalore,NLP
Learn Five Habits of People With High Emotional Intelligence,NLP
Constructing Robust Life by Decoding Life Coaching,NLP
Who are the major NLP teachers? Are there any recommended training programs?,NLP
Learn How to Feel Cool at Work with NLP,NLP
Change Yourself to Change the World with NLP Training,NLP
Emotional Intelligence,NLP
Why NLP Coaching Certification is Different Than Other Courses,NLP
Olfactory anchors?,NLP
Learn How to Manage Emotions with Raised Emotional Intelligence,NLP
Four Habits to Seek in a Life Coach,NLP
Modelling Success?,NLP
Let’s start with the beginning. What is NLP Therapy? This is a misleading question. We can not give it a single definition,NLP
What is Neuro Linguistic Programming - Mindworks NLP Licensed Trainers o...,NLP
What is NLP? Neuro Linguistic Programming,NLP
Curious,NLP
NLP Modelling (more ranting),NLP
Motivation through NLP,NLP
Will knowledge graph be the future of natural language processing？,NLP
NLP Practitioner Certification Course (Beginner to Advanced) is 94% off (promotion),NLP
Seattle NLP Live Training - Licensed Practitioner of NLP April 2018,NLP
Do techniques for erasing memory exist?,NLP
5 Different priceless skills you will learn at the NLP,NLP
NLP issue,NLP
Identifying the Lynchpin in PTSD,NLP
Manipulation levels [[NLP,NLP
What pattern to use to quit watching TV?,NLP
Anxiety around a goal / Get addicted to a goal like to a video game?,NLP
NLP sales techniques,NLP
Any way to become fearless completely?,NLP
[Free File][Patreon Supported][F4M] Morph Girl [Hypnosis][HFO][Fantasy][Monster girl][Relaxing][Music][Binaurals][Long],NLP
Moving on from someone you deeply connected with in the past? Overcoming an obsession?,NLP
what is the NLP model of the mind?,NLP
What have you guys accomplished with NLP?,NLP
"How Do I ""program/refrase"" myself when I see a |pit fractal of emotion | in one of my sentences?",NLP
"""One Flew Over The Cuckoo's Nest"" Recursive Frame Analysis",NLP
Sneaky NLP practices for a Game?,NLP
2 Things NLP Gurus Don't Want You To Know,NLP
Breaking the Rules - NLP Advanced Mastery Training 2009 with Andrew T. Austin,NLP
"NLPers are STILL claiming to be members of the British Board of NLP, over 10 years later...",NLP
Sleight of Mouth Patterns in Schizophrenia,NLP
Accidental Post Hypnotic Suggestions in Clinical Treatment Settings,NLP
How To Change Your Mental State | Modalities Explained,NLP
Best Beginner NLP resources?,NLP
NLP - How To Use A Person's Name For Instant Rapport,NLP
NLP is already a thing? Of course it is.,NLP
Enjoying to work with# NLP at Illuminations,NLP
"'The Map Is Not The Territory' Explained, NLP BASICS",NLP
How to stop unwanted mental-movies,NLP
Precious Emotional Intelligence Learnings when merged with #NLP,NLP
"Wow, I’m blown away with what I’ve seen done with NLP, what are your favorite resources? I want to learn!",NLP
NLP Master Practitioner Certification,NLP
NLP Coaching Level 3,NLP
"“To enjoy good health, to bring true happiness to one's family, to bring peace to all, one must first discipline and control one's own mind. If a man can control his mind he can find the way to Enlightenment, and all wisdom and virtue will naturally come to him.” -Buddha",NLP
Autosuggestion And Reprogramming The Subconscious (Franz Bardon Hermetics),NLP
Was NLP used on me,NLP
best nlp trainers in india,NLP
Bad memories have the power to ruin the present moment and our future. The good news is that you can remove these bad memories instantly with a practical and powerful NLP method.,NLP
NLP Metaphors - The Story of two friends,NLP
Integrative NLP Practitioner Certification® Training - Placing Success in Your Future,NLP
Empowerment Breakthrough Trainings - Clearing Anxiety From Your Future,NLP
"There are 8 ""rules"" in NLP. Here's 4 of them",NLP
I need help with my health ASAP,NLP
What is NLP and Available Certification Courses & Trainings in India,NLP
NLP Coaching Mumbai,NLP
NLP- Learn How To Manage Others By Listening And Talking,NLP
How much should NLP therapy cost?,NLP
Simple Registration For Nlp Certification Bangalore Towards Better Prospects,NLP
The Four Agreements: Best way to be spoken,NLP
Three things that changed my life - Ashish Sehgal - NLP Training and Lif...,NLP
How long does it take to become an advanced NLP practicioner?,NLP
NLP Trainer in India,NLP
Valuable NLP Training in India,NLP
Best Bandler speech/training/presentation? What moved you.,NLP
I want to share all the knowledge that i have in the field of NLP with people and genuinely help them. How can i take this up professionally?,NLP
NLP Training Videos: Triggers & Responses,NLP
Question about voice tone/pausing/volume/speed,NLP
How to Master the Skills of an Expert NLP Practitioner,NLP
Questions regarding the Circle of Excellence technique,NLP
NLP Training in Delhi,NLP
Any POWERFUL NLP techniques about developing a SOLID sense of self. Overcoming social pressures.,NLP
How to Design POWERFUL Presentations using NLP,NLP
Some questions about NLP submodalities,NLP
ESTILO & VIDA: Autoconfianza para enfrentar los grandes momentos,NLP
NLP TRAINING IN DELHI INDIA,NLP
General discussion.,NLP
Are there any dangers of NLP?,NLP
Hi,NLP
Set goals not expectations,NLP
An ultimate technique to repair your mind through emotional intelligence,NLP
Rediscover your inner self through NLP training,NLP
5 amazing skills you must learn at NLP training,NLP
Need guidance on building a NLP model,NLP
"Focus is our inner universe, it always expands",NLP
For the next few weeks the online PTSD treatment course is available for free.,NLP
NLP Certification India,NLP
NLP Coaching Mumbai,NLP
Intention and Open Loops,NLP
Looking for a sub about verbal ticks,NLP
Learn To Attract More Luck In Your Life Using NLP,NLP
Curing a phobia without words.,NLP
Help finding nlp therapist?,NLP
Questions on NLP and if it could help me with my thesis,NLP
What can I usefully watch out for when dealing with an NLP-proficient person?,NLP
"What are stome tips to resist hypnosis, manipulation and persuasion from an NLP-proficient person?",NLP
Is NLP/NeuroLinguisticProgramming still a thing?,NLP
NLP Pratitioner Certification India,NLP
NLP Trainer in India,NLP
"hello, im looking for a nlp practitioner to ask a couple of questions.",NLP
"NLP CLIP: Unlearn ""Learned Helplessness""",NLP
Best NLP Business Practitioner,NLP
Best NLP in business,NLP
Hypnosis- Treat Your Allergy with Self Hypnosis,NLP
Hypnosis – Overcome Guilt Using Self Hypnosis,NLP
Cripple Sex - just an ordinary day in the residential rehab unit... (Blog post),NLP
Hypnosis: End Your Financial Problems Using Self-Hypnosis,NLP
Best Team Coaching,NLP
New Behavior Generator: Guided NLP Walkthrough with Perceptual Positions,NLP
NLP Training,NLP
NLP-Let Go Of Your Past Trauma Using NLP Techniques,NLP
Any one done a seminar like this ot a Tony Robbins one? Which should I choose if I do one next year?,NLP
How to improve public speaking skills,NLP
How To Create A Vision Board To Attract What You Want,NLP
How To Create A Vision Board To Attract What You Want,NLP
Best nlp sales techniques,NLP
"For some people this is the key to becoming aware of their internal representations. If this happens to you, please share!",NLP
Best Neuro Lingusitic Programming in India,NLP
Integrative NLP Training,NLP
The Power of Acceptance with Neuro-Semantic NLP,NLP
"MoM Analysis of a Metaphor - ""I Have No Neck""",NLP
7 Steps to Developing Good Habits for Self and Business Transformation,NLP
Free NLP Crash Course - 15 minutes of watch time,NLP
Tony Robbins Breaks the Science of Achievement Down to 3 Simple Steps,NLP
NLP Certification in Delhi,NLP
NLP and identity/ego/taking things personally,NLP
How to train yourself and train others by mastering NLP,NLP
Best nlp training in mumbai,NLP
NLP Certification Courses India,NLP
"I only really dabble in NLP, but wanted to share this youtube channel, NLP gym. I feel like it really covers all the bases and he doesnt seem to get that many views.",NLP
She's Mirroring him so that's a yes. Right?,NLP
The Problem with Nigel,NLP
How can I improve my approach ?,NLP
How to make an NLP promotional video,NLP
Neuro Linguistic Programming (NLP): Master the language of your brain| SecretSifu,NLP
How an NLP book (Steve Andreas: Transforming Your Self) helped me tackle the causes of my anxiety & depression,NLP
How to Overcome Perfectionism and Take Action,NLP
"Best & Top NLP Trainers training in Delhi, India",NLP
Best nlp store,NLP
Best nlp modelling,NLP
Best coaching certification online,NLP
Derren Brown.,NLP
Creating Characters to combat motivation issues,NLP
Guys i am going to do a NLP training.,NLP
What is NLP? How would you describe in 10 effective words?,NLP
"Creating and Utilizing characters to act as, to conquer motivation issues.",NLP
NLP Certification in Delhi,NLP
Pretty simple explanation... but powerful if executed.,NLP
How could I overcome someone's hatred and/or ignorance?,NLP
What is your essential Neuro Linguistic Programming reading list?,NLP
What is your opinion on escaping the body form of an individual? Are there any techniques that can be used in order to overcome self body shaming?,NLP
Libary for natural language identification in Rust,NLP
NLP Certification in Delhi,NLP
"Ranting Again, this time about fake qualifications...",NLP
New here!,NLP
NLP Essentials Online Course - 70% off,NLP
Best banking training in india,NLP
Best business nlp training,NLP
best nlp trainers in india,NLP
NLP Resource States and How to Find Them,NLP
Intrusive thoughts,NLP
Looking for a NLP Hypnotist,NLP
Chase Hughes of http://www.ellipsisbehavior.com/ Current MK Ultra Programmer with Evidence,NLP
More ranting. This time about NLP Modelling,NLP
Certified nlp master practitioner,NLP
Best hypnosis commands,NLP
Free NLP training pdf,NLP
What are 3 basic language patterns one should start with?,NLP
NLP Love,NLP
NLP technique important for sales and negotiations,NLP
Where do I start?,NLP
NLP and sex?,NLP
Where can I find LISP-formatted thesauruses distributed by Dekang Lin?,NLP
The Current Operations Going On Are Discussed In Some Detail.,NLP
How to Use the NLP Swish Pattern to Redefine Self-Image,NLP
"NLP Certification Courses & training, coaching programs in India",NLP
NLP Ethical Influence Tip: Save the Best for Last,NLP
Yes this official knew some of the darker N.L.P;. patterns.,NLP
"[question] I have really debilitating shy bladder which doesn't allow me to pee in public, can someone recommend a way I can use NLP to overcome this?",NLP
My 3 Question Headache Cure PLUS how I cured a migraine through texting,NLP
"How to use NLP for deeply embodied stuff, even without Internal Representations",NLP
"Psychological Operations, [Psyops] Are Disclosed with the FacTs.",NLP
On Guilt.,NLP
Certified nlp certification,NLP
Media Package,NLP
A Powerful NLP Hypnotic Language Pattern Everyone Should Know,NLP
"Interrogation Techniques and Body Language Reading, with Murray",NLP
"New to NLP, programming with my girlfriend?",NLP
NLP Submodalities: A Guided Experience,NLP
Is NLP a solid science?,NLP
Could use some help getting my viewpoint across to a manipulative person.,NLP
The REAL difference that makes a difference for Lasting Change with NLP,NLP
"People Core Basics Needs, Fears, and how to Exploit Them for Mind Control.",NLP
GRAPHIC Project Monarch Exposed In Detail This Was Hard To Make :(.,NLP
Intro to Self-Actualization for NLPers,NLP
"Here is a list of all the Governors in the U.S.A. Please contact them in a peaceful, respectful m...",NLP
"6/18 New Updated Files on Mind Control, Hypnosis, Intelligence, and Medical.",NLP
"Practical Ways To Stop The N.W.O., The Illuminati, and The Elite, Peacefully.",NLP
MK-Ultra Mind-Control Documentary: Techniques &amp; Celebrities Revealed *WARNING CONTAINS TRIGGERS!*,NLP
The Terrifying Epidemic Of Mind Control Targeting Our Young People Exposed,NLP
NLP Certification,NLP
"*Updated Excellent file with PDF's on Mind Control, Guerrilla Linguistics, Manuals and Survival.",NLP
Anonymous - This is going to Change Everything We Know... (CIA Secrets EXPOSED 2017),NLP
Torture Techniques That Were Used But Not Revealed Until Now.,NLP
Richard Bandler & the Yoghurt Experiment,NLP
"The Symptoms That Come With Being Under Mind Control or Have ""Alters"".",NLP
Great resources for the meta model?,NLP
The Truth about MK Ultra From Myself a Former Programmer. Thanks.,NLP
"A client describing the NLP ""gestalting"" Experience",NLP
NLP Presuppositions Compendium - Free short course about NLP Presuppositions.,NLP
What Are You Missing? NLP for Everyone Series.,NLP
Bandler - State of the Art 1987 - Time Distortion,NLP
"A Treatise on The Work Of Cults, and Their Tactics Â This is a little treatise on Brain Washin...",NLP
Can't Visualize your Internal Representations? You're not alone! [Article below],NLP
How to Change Beliefs Naturally: 4-Step Neuro-Semantic NLP technique,NLP
The Targeting Of College Students For Mind Control Explained.,NLP
Free NLP Practitioner Training Program (17 Modules. 250-Page Workbook),NLP
NEW!! Whatsapp group for NLP & HYpnosis.,NLP
"** SEE PICTURES TO SEE WHAT GROUPS I'M INVOLVED IN, ONE WAS MORE IN THE PAST. Â I've been relucta...",NLP
"A Former Case of mine about ""Jack""",NLP
NLP in India,NLP
Have you noticed changes in your life after studying the Meta Model?,NLP
Description of Evaluation metrics for short answer grading,NLP
Some Black Op Type N.L.P. & Behavioral Engineering,NLP
Einstein and ‘Psychology’ in 7 Powerful Sentences,NLP
Thought Vibrations,NLP
I'm thinking about attending an NLP class here in NYC. Any suggestions or advice? I'm totally new to this. I would be taking it for myself and not using it to coach others...,NLP
6 Models to Take Your NLP & Coaching to the Next Level,NLP
The Meaning of Your Communication is in the Response You Get,NLP
The law of Requisite Variety,NLP
Link to the full vid: https://www.youtube.com/watch?v=xqFo2j50-Vk,NLP
#truth,NLP
Ranting on the relationship between NLP and the 419 Nigerian scam,NLP
The Models of Neuro-Linguistic Programming (NLP),NLP
True Power with NLP,NLP
How to Get Rid of Boredom with NLP,NLP
More ranting - this time I pick on Life Coaches. Grrr!,NLP
NLP Practitioner & Coaching Cert 2017,NLP
Relationship Problems | Experienced NLP Practitioners - Wellthlink,NLP
The Top 3 Myths of NLP Submodalities: Why Submodality Shifts Don't Always Work?,NLP
Enhanced NLP: Moving from Sensory Representations to Frames of Reference,NLP
Tibetan bowls for study,NLP
Modelling Excellence with NLP by Breaking Experience into Pieces,NLP
Characteristics of those achieving mastery,NLP
Modelling Excellence with NLP by Breaking Experience into Pieces,NLP
The most foundational NLP Presupposition: The map is not the territory,NLP
Open NLP Name Finder Model Training Sagar Gole's Blog,NLP
How to advertise your NLP services effectively.,NLP
NLP Discord,NLP
NLP discourse segmentation dataset,NLP
"NLP, Metaphors, Neurology and Depression - video, 20mins",NLP
A lot can happen when one is in a free fall descent following an accident,NLP
Reframing NLP - Learn the Reframing NLP Technique,NLP
NLP Fast Phobia Cure - How to Perform The NLP fast Phobia Cure,NLP
Would you take a drink from the Reverend Jimmy Jones...,NLP
Why no mention of Wiseman's study?,NLP
Saddle Up The Unicorn - Even more blog ranting!,NLP
"""Just a Small Prick"" - more NLP blog ranting",NLP
NLP and hypnotherapy,NLP
Bji,NLP
Institute of Hypnotherapy & NLP,NLP
Any book recommendations in re: Ericksonian Models?,NLP
NLP Training In India,NLP
Something weird and kind of genius (maybe unintentionally so) I've noticed people do.,NLP
NLP - the fastest way to unemployment?,NLP
Furthering my journey of Self Development,NLP
They walk among us.....,NLP
Question: Why isn't there more documentation on practicing NLP on men?,NLP
"Persona Non Grata, who are we permitted to like in NLP?",NLP
NLP in VR Check out this guide to visual sub modalities in Virtual Reality,NLP
NLP in VR,NLP
Hearing metaphoric communication differently...,NLP
The problem with Well Formed Outcomes (video),NLP
"Sex, Stalking and NLP Training....",NLP
Nlp and hypnotherapy courses,NLP
The British Bored of NLP - the scam that never quite went away.,NLP
Anybody know a good seminar/ on uptime/downtime?,NLP
Extract date and time from Hindi sentence,NLP
Request: Richard Bandler MP3s.,NLP
"Free NLP audio downloads, over 1000 articles and pages, NLP, Neurology, Hypnosis",NLP
ApexNLP: A natural language event parser for java and android,NLP
The Neuroplastic Brain: Our Malleable Learning Machine,NLP
can you use NLP to cure severe food allergies?,NLP
What is NLP Therapy - Salusacademy,NLP
NLP Edmonton Facebook Group,NLP
NLP Super Confident Now Using 4 NLP Techniques,NLP
Kellie Leitch on Screening for Canadian Values,NLP
What is NLP?,NLP
"NLP in VR - submodalities in VR - ""Once Upon a Beach - Submodalities in Space""",NLP
Kindle Book- NLP Become Super Confident Now Using 4 NLP Techniques,NLP
Sex without bla bla bla. Only Sex,NLP
Time vs Money - You're going to die some day.,NLP
NLP training and certification provider in Bangalore India,NLP
Haley20,NLP
"Women in Science Day: Interview with Nandini Stocker, Google's Conversation Design Lead",NLP
NLP- QUIT SMOKING NOW USING NLP & HYPNOSIS TECHNIQUES FOR FREE,NLP
NLP- LOSE WEIGHT NOW USING POWERFUL NLP TECHNIQUES,NLP
NLP- REMOVE FEAR OF FLYING USING NLP TECHNIQUES,NLP
NLP Trainer in Bangalore,NLP
Fuck me please..,NLP
"Sorry to interrupt, but",NLP
NLP- REMOVE FEAR OF HEIGHT USING NLP TECHNIQUES,NLP
NLP- REMOVE FEAR OF EXAMINATION USING NLP TECHNIQUES,NLP
NLP- BE HAPPY NOW USING SIMPLE NLP TECHNIQUES,NLP
Will уou lеt mе sреak?,NLP
NLP- MANAGE YOUR ANGER WITH NLP,NLP
NLP and Hypnotherapy,NLP
5 SIMPLE NLP TECHNIQUES TO OVERCOME ANXIETY,NLP
Would using an instant-messaging app instead of real-life greatly hinder the effectiveness of NLP?,NLP
3 steps to How YOU can be Limitless - Using NLP not NZT!,NLP
NLP made me feel worse?,NLP
Anchor to the thought of something?,NLP
Quick anger stopper.,NLP
New to NLP.,NLP
NLP in Bangalore,NLP
NLP in India for leadership & leadership,NLP
NLP-LEARN TO ATTRACT MORE LUCK IN YOUR LIFE USING NLP,NLP
"There's 8 guidelines of NLP, here's 4 of them.",NLP
Struggling with using NLP to make people 100% loyal to a group,NLP
Any1 know how to make oneself more humble?,NLP
PNL & Coaching: por qué nos quejamos?,NLP
PNL & Coaching: Qué son los Centros de Interés? (Meta Programas),NLP
Zhuan Falun (Turning The Law Wheel),NLP
New NLP book — I hope it succeeds in being a conversation changer in the NLP community,NLP
How to Combine NLP with Hypnosis to Become a Better Hypnosis,NLP
No Illusion...Only Reality...,NLP
NLP life Training Coaching India,NLP
NLP-Life Training and coaching,NLP
Searching for NLP active forums,NLP
Why do I keep pushing people to change?,NLP
Need your Help Lonely College Student Living in Poverty,NLP
NLP in India,NLP
[Discussion] Is NLP Bullshit?,NLP
NLP trainer training In Bangalore,NLP
Trans human NLP training provider,NLP
How can I use NLP to make me practice NLP during conversation?,NLP
NLP training in India,NLP
"How can I learn how to properly execute NLP patterns, and create my own? =]",NLP
NLP Training in India,NLP
"(I'm from a non-English speaking country) What does it mean if someone uses English when writing or saying something they feel about me/someone in general? Specifically, does it mean they're lying? Does using their non-native language imply dishonesty and falsity of their (emotional) statement?",NLP
NLP certification courses,NLP
Anyone have back issues of Anchor Point?,NLP
NLP+MBTI Live Event at 7 PM CST,NLP
