title,subreddit
About us. About coaching with NLP. Who are we and what is our mission st...,NLP
Exclusive Gift - Learn Deep Insights Into NLP From The Co-Founder Of NLP,NLP
The Hypnosis Pill – The Use of Hypnosis as a Medical tool,NLP
Getting Good With The Techniques of NLP: Fixate On Function & Repetition Then Go For Variety...,NLP
Why You Shouldn’t Always Trust Your Senses.,NLP
Hypnosis In Long Term Relationships,NLP
Video NLP Time Line Therapy - Letting go of Negative Emotions by Tad James,NLP
"Learning, Change And The Science Of Pimping Your Brain",NLP
6 Tips To Having A More Fulfilling Life Today,NLP
Free NLP Video Series,NLP
Access Your Free Business Building 101 Report,NLP
Free NLP Videos from NLP Times,NLP
How To Anchor An Audience NLP Style,NLP
How do I get started learning about NLP?,NLP
NLP Interview Techniques: Selling Yourself in a Challenging Market,NLP
Leverage The Power of (Intentional) Rituals,NLP
NLP Spirituality - Cool Things That The Technology Can Do To Help You Grow,NLP
Does NLP Work In The Long Term,NLP
Can NLP Help You To Be A Better Coach?,NLP
Professional Business Coaching- An Effective Guide for Small Business,NLP
Annoying song?,NLP
Working With Clients - 10 Common Traps To Avoid,NLP
The Oda Network,NLP
The Advanced Skills Of NLP,NLP
INTERMEDIATE SKILLS OF NLP,NLP
NLP Times Invites You To Become An Affiliate,NLP
[Nocebo] The UK health industry destroying health with suggestion. Choose to feel healthy regardless of what you do or see depicted. Discredit garbage like this to yourself.,NLP
Remembering the past,NLP
The Opportunities to Apply NLP In Everyday Life Are Nearly Limitless,NLP
advice on visualisation using NLP,NLP
Any recommended reading for learning NLP?,NLP
NLP FOR BEGINNERS,NLP
NLP Times Products,NLP
Ethical Mass Surveillance or Mass Manipulation?,NLP
"Honey, shrink your enemy! Submodalities in action.",NLP
In enkele minuten weet je hoe je meer uit jezelf kunt halen. Overkom obstakels en update je vaardigheden.,NLP
what is NLP,NLP
The Future Of /r/NLP - Just A Thought..,NLP
Call for papers - the 1st ACL Workshop on NLP and Social Dynamics,NLP
Szkolenia NLP,NLP
How leaders influence their environments,NLP
Ultimate Prosperity DNA Upgrade Your Life,NLP
"Inspired by NLP, I've created /r/moodmusic, a place to share music we use to deliberately induce specific mental states. Please subscribe and contribute.",NLP
"Inspired by NLP, I've created /r/musicmood, a place to share music we use to deliberately induce specific mental states. Please subscribe and contribute.",NLP
I've made a quiz app to learn VAK words,NLP
Free NLP Techniques,NLP
Recognized Entrepreneur and Peak Performance Expert,NLP
What is Neuro Linguistic Programming NLP?,NLP
NLP is a Unique Generative Model of Change and Transformation,NLP
Motivational Speaker | Carol Talbot NLP Speaker Dubai,NLP
Richard Bandler book that focuses on handshake induction hypnosis,NLP
Dealing with Rhetorical Condescension?,NLP
Neuro Linguistic Programming-Life-Maximization Spiral in 7 days,NLP
NOOB....NLP or Hypnotherapy as healthcare practitioner?,NLP
Did you know the brain uses its very own language? The language of the brain- Neuro-linguistic Programming (NLP)...,NLP
What are common questions to ask others to access certain memories?,NLP
"Question: in relationships, does one person maintain a leading position while the other paces?",NLP
I keep repeating a thought - I feel messed up,NLP
Understand Depression and Overcoming it Using NLP,NLP
Has anyone tried Design Human Engineering,NLP
The Higherside Chats Podcast: Neuro-linguistic Programming & Tips For Mental Mastery w/ special guest Richard Bandler!,NLP
Analyzing Obama's Syria Speech,NLP
"Generalizations, Deletions and Deletions",NLP
"X-post from AskReddit, where people need schooling badly. ''Redditors who have been hypnotized, is it all a hoax?"" hahahaha",NLP
Who is Really in Control of your Mind? Success through NLP,NLP
In need of good books,NLP
What is NLP and its Benefits?,NLP
Details on the eye gaze technique,NLP
I am skeptical of NLP.,NLP
"Is there NLP going on here? (Obama: ""We Don’t Have A Domestic Spying Program"")",NLP
NLP Melbourne,NLP
Designing SMART Goals for Your Success,NLP
NLP Course Alternatives - Free NLP Training and Learning NLP at Home,NLP
Looking for good NLP teachers in the Denver Area,NLP
How can I break a pattern in my own life,NLP
The NLP View: Lisa Wake Discusses A Post Modern Perspective of NLP,NLP
NLP / Hypnosis in Obama speech analyzed,NLP
Top 5 Precision Language Techniques,NLP
NLP Training and certification in India,NLP
NLP materials,NLP
How to Improve Your Strategies to Improve Your Results,NLP
5 NLP Techniques to Quickly Grow Your Business,NLP
Neuro Linguistic Programming Training,NLP
"NLP is not ""Neuro LINGUISTIC programmin""",NLP
Learn NLP Techniques Online,NLP
How can I use NLP on myself to get rid of the belief that NLP won't work for me.,NLP
Most value for money NLP Training in Malaysia,NLP
The weirdest languages (x-post from /r/linguistics),NLP
NLP Swish Technique,NLP
Most value for money NLP Training in Malaysia,NLP
The NLP View: Pamela Gawler-Wright Discusses NLP in Trauma,NLP
How do you get good at NLP the right way?,NLP
"10 plus 3 Blogs, die du lesen musst, wenn du ein Leben nach eigenem Standard führen willst.",NLP
Benefits of Self Development Through NLP,NLP
Resolving Conflicts With Your Father Using NLP,NLP
10 neue Taktiken für den ambitionierten Chaos-Guerilla | Benedikt Ahlfeld • Ein Leben nach eigenem Standard.,NLP
What Is NLP And How Can It Help Me?,NLP
Carol Talbot as the Best Motivational Speaker Dubai,NLP
Representational systems- BS?,NLP
"Anchoring attempt, good result, but unexpected to say the least..",NLP
Amy Cuddy: Your body language shapes who you are,NLP
Fighting people in the shower,NLP
what are good reads for beginners? what are some good exercises as well?,NLP
Visualization vs suggestions,NLP
Stay rude – Stay rebel! Radikale Ehrlichkeit für ein Leben ohne Bullshit.,NLP
Die Gesetze des Geistes: warum wir ständig programmiert werden und wie wir die Kontrolle über unsere Gedanken zurückgewinnen können.,NLP
48 herausragende Persönlichkeiten verraten ihr Geheimnis für ein Leben nach eigenem Standard.,NLP
Help me removing my inhibitions,NLP
Das Projekt “Gestalter der Zukunft”. Ein Videoblog aus Australien,NLP
So findest du deine Ur-Motivation und lebst deine Bestimmung. Die 7 merkwürdigen Geschenke für Gestalter der Zukunft.,NLP
Advice on how to anchor and use a positive moment during a job interview.,NLP
"Der Chaos-Guerilla: 3 einfache Wege, sich sofort besser zu fühlen und damit allen auf die Nerven zu gehen.",NLP
I was reading about subliminal visual programming and came to the conclusion that a film with the right script would be capable of programming the brain in a positive way...,NLP
"How Does One program him/herself? Also, what are some good resources to work with?",NLP
Spinning feelings,NLP
"Das Geschäft mit den guten Gefühlen: Die Wahrheit über Gurus und die größten Lügen, die sie geheim halten wollen.",NLP
Can someone help me out with an issue I have already pinpointed?,NLP
Hakuna Matata. Bitch. | Benedikt Ahlfeld • Ein Leben nach eigenem Standard.,NLP
"Willkommen zu ,Ein Leben nach eigenem Standard‘. Warum ich will, dass du das hier liest. Regelmäßig.",NLP
Just finished Day 1 at NLP Marin and I loved it.,NLP
"ZHI.at - NLP und Hypnose in Wien, Österreich, Hamburg und München, Deutschland",NLP
wikichallenge entries,NLP
NLP the start,NLP
Just launched an Android NLP app for my mother,NLP
enlp.ro - eNLP,NLP
Reticular Activating System - How NLP and The Law of Attraction works,NLP
"3 Effective Methods Of Persuasion That You Need To Know
",NLP
"NLP Technique – Planning to Succeed
",NLP
"The Five Steps for Success
",NLP
NLP and quit smoking,NLP
Any simple NLP tips to use in a job interview conducted by video conference?,NLP
"Magic Rings of Power, or A Simple Way to Improve Your Golf Game",NLP
Want to learn NLP,NLP
Generating a multiple choice quiz from content to determine a users level of knowledge ,NLP
This maybe a stupid question... But can you actually tell me what NLP looks like in action?,NLP
Is NLP certification a *Legal* requirement for explicitly claiming to use NLP with clients in the USA?,NLP
8 Ways To Maintain Your Productivity After a Long Day at The Office,NLP
"Change: Signed, Sealed, Delivered.",NLP
The Usefulness Of Disassociation,NLP
Nothing Up My Sleeve!,NLP
Lost In Your I's,NLP
Gather Ye Rosebuds,NLP
There’s No Such A Thing As Addiction,NLP
Why humans aren't pythons,NLP
/r/NLP: Apologies all for the absenteeism. I'm back and will now proactively be looking after r/NLP,NLP
Why Not Take a Picture? It Lasts Longer!,NLP
The Personal Engine That Could,NLP
Let the Unconscious do the Heavy Lifting,NLP
Don't Forget To Remember...Every time!,NLP
Misinformation Society: Why People Just Can't Believe The Truth,NLP
Firing Anchors In Austin,NLP
Too Much Of The Wrong Information Can Kill Your Outcomes,NLP
Mismatch Ping Pong,NLP
"If I'm Pointed This Way, It Must Be Lunchtime",NLP
I Love You–I Hate You  Please Make Up My Mind | Bright Mind,NLP
Open Your Mouth Wide And . . .,NLP
Researching a Non-Issue: NLP Doesn't Lie,NLP
Your Life Is Based On A True Story,NLP
This Page Is Intentionally Left Blank,NLP
When Guileful Eyes are Smilin',NLP
"nlp
",NLP
"Testing, Testing: One, Two, Freeze!",NLP
One Key Reason Coaching Fails,NLP
Intensity Makes It Click,NLP
NLP,NLP
How to Dis Your 'Sociation,NLP
Some Big Reasons To Take On Your Client's Experience,NLP
Suggested reading for identifying narrative point of views in fiction?,NLP
Suggested reading on identifying perspective in literature?,NLP
"The A's, An's, and The's of Rapport",NLP
Meaning Maneuvers: Words That Change Minds,NLP
Seeing the World with Innocent Eyes,NLP
What Does A Person Need In Their Life To Be happy?,NLP
Hello NLP community I have some concerns.,NLP
Banishing the Ghosts of Yuckiness Past,NLP
John Grinder: Stealing anchors (and group rapport) from informal leaders,NLP
"John Grinder talk. How language evolved from a mere accounting system for the environment around us, to become a generative force for new maps and possible worlds. And the opposite problem.",NLP
Is there really a modern app for Rapport?,NLP
Good interview with a young Bandler talking about submodalities and the matching and mismatch of physical cues,NLP
The 10 essential habits of positive people,NLP
"Truth may Come from the Heart, but it Comes in at the Eyes",NLP
NLP reading suggestions?,NLP
Doing One Thing Different Can Make All The Difference,NLP
Shouldn't Your Coach Be A Master Of Change?,NLP
What Makes Bright Mind Coaches Unique?,NLP
"""Think Better"" Ad Make You Want To Know More",NLP
Use Your Brain With A New Idea In Mind,NLP
A Question Of Growth: ask this daily question to increase your success!,NLP
NLP Use Online?,NLP
What the hell is NLP? An overview for the... [X-Post from /r/trueplayer],NLP
"What the hell is NLP? An overview for the interested, the confused, and the horny. [X-Post from /r/trueplayer]",NLP
Nlp against Procrastination?,NLP
NLP Advice please...,NLP
NLP advice????,NLP
Does NLP work?,NLP
Dating success predicted by language style (ie. subconcious mirroring of word choice creates raport).,NLP
NLP in job application ?,NLP
A Good Introduction to NLP - I was looking for one and this is the best I could find online,NLP
About the New Behavior pattern,NLP
What is a good technique for placing greater importance on an event?,NLP
Explain nested loops,NLP
What happened to Major Mark Cunningham?,NLP
Anchoring a feeling/ state of mind for 'clumsiness' ,NLP
/r/nlp meetup in London anyone?,NLP
NLP seminar coupon available in my hometown (Perth). Should I bother? /NLP_noob,NLP
hi /r/nlp beginner here,NLP
Interview technique,NLP
Interview technique,NLP
Is anyone familer with any 3-d mind techniques?,NLP
Break up,NLP
NLP = Változás,NLP
Hatékonyság,NLP
Tedd!,NLP
Megtérül-e a befektetés önmagunkba?,NLP
Képzeld el!,NLP
Reframing - egy példa,NLP
Building Rapport Through Power Words - How to Mind Control,NLP
What readings do you recommend to start with?,NLP
Life Coaching Tips - How To Use A Methapor To Coach A Client Through A Mental Block,NLP
Losing to the competition’s 90-100% discount gifts? Try this wicked metaphor,NLP
I'm doing a NLP Practitioner course next week. Any tips?,NLP
Is it possible/wise to self-treat a psychological condition using NLP?,NLP
Can NLP be used to help treat ADHD?,NLP
Why is NLP useful? --->,NLP
"self-made reframing technique - your critique, please?",NLP
anybody want to try something new?,NLP
Using NLP in a non-clinical environment,NLP
mindletics nlp lancashire,NLP
nlplancashire.,NLP
Should I subscribe? Too soon?,NLP
Eye accessing game.  (scroll down),NLP
NLP Training,NLP
NLP - Post your language patterns here for discussion and sharing.,NLP
Is there NLP in this interview?,NLP
"Trainers Training, tips?",NLP
Building resources to syntactically parse the web,NLP
"I learned more about NLP from this than any other reading, video or audio.",NLP
New Edition of Essential NLP Released by Speak First Presentation Skills Experts,NLP
Let's argue: I think NLP is bullshit.,NLP
Neuro-Linguistic Programming: Recommended reading,NLP
Salad Ltd: A series of videos as a taster to NLP,NLP
Neuro-Linguistic Programming: Are there ethics to the practice in business life?,NLP
Top NLP Business Trainer Publishes Leading Edge eBook and DVD ‘A Useful Guide to NLP for Coaches’,NLP
NLP Business Practitioner Course for a business coach,NLP
Timeline therapy works!,NLP
Art Giser Interview: How to Retrieve Your Energy,NLP
"An Evening with Richard Bandler in London, 15th April",NLP
The Basic of Hypnotize Someone Fast,NLP
"To nowy portal stworzony z myślą o dojrzewaniu NLP oraz sceny samorozwoju. Będziemy tu umieszczać informacje na temat nowości książkowych, technologii a także nowości w dziedzinie szkoleń w Polsce tak jak i na świecie.",NLP
Are your words killing you?,NLP
Most Mis-quoted NLP Statistic,NLP
"Neuro-linguistic programming - Wikipedia, the free encyclopedia",NLP
